{"schema_version":"cognitive-runtime.generation-manifest/v2","contract_version":"v2","package_version":"0.1.0","source_revision":"revision-synthetic","sync_generation":"generation-aaaaaaaaaaaaaaaaaaaaaaaaaaaaaaaaaaaaaaaaaaaaaaaaaaaaaaaaaaaaaaaa","files":[{"path":"registry.json","checksum":"sha256:0000000000000000000000000000000000000000000000000000000000000000","dependencies":[]}]}
